{
  "entry_id": "CDQ-20260706-109",
  "queued_at": "2026-07-06T17:45:00Z",
  "status": "owner_reviewed",
  "source": "startup_report",
  "finding_type": "degraded_custody",
  "description": "This entry was created with non-pending status",
  "custody_context": {
    "contract_id": "#23",
    "receipt_count": 5,
    "detail": "Status validation test"
  },
  "advisory": true,
  "owner_required": true,
  "owner_decision": null,
  "cross_project": false
}
